{
  "$schema": "https://open-design.ai/schemas/plugin.v1.json",
  "specVersion": "1.0.0",
  "name": "example-html-ppt-zhangzara-broadside",
  "title": "Html Ppt Zhangzara Broadside",
  "version": "0.1.0",
  "description": "Broadside — Dark editorial canvas with a single fire orange accent and bilingual Latin/Chinese type stack. Anything that should land like a broadside newspaper headline: brand manifestos, magazine and cultural pitches, design talks, bilingual EN/CN decks, founder vision statements.",
  "license": "MIT",
  "author": {
    "name": "Auto Design",
    "url": "https://github.com/nexu-io"
  },
  "homepage": "https://github.com/nexu-io/open-design/tree/main/plugins/_official/examples/html-ppt-zhangzara-broadside",
  "tags": [
    "example",
    "first-party",
    "deck",
    "marketing",
    "web",
    "broadside",
    "zhangzara-broadside",
    "editorial",
    "dramatic",
    "graphic",
    "punchy",
    "brand-manifesto",
    "founder-vision-deck",
    "html-deck",
    "html-slides",
    "zhangzara"
  ],
  "compat": {
    "agentSkills": [
      {
        "path": "./SKILL.md"
      }
    ]
  },
  "od": {
    "kind": "scenario",
    "taskKind": "new-generation",
    "mode": "deck",
    "scenario": "marketing",
    "surface": "web",
    "preview": {
      "type": "html",
      "entry": "./example.html"
    },
    "useCase": {
      "query": {
        "en": "Broadside — Dark editorial canvas with a single fire orange accent and bilingual Latin/Chinese type stack. Anything that should land like a broadside newspaper headline: brand manifestos, magazine and cultural pitches, design talks, bilingual EN/CN decks, founder vision statements.",
        "zh-CN": "使用这个插件完成以下任务：Broadside — Dark editorial canvas with a single fire orange accent and bilingual Latin/Chinese type stack. Anything that should land like a broadside newspaper headline: brand manifestos, magazine and cultural pitches, design talks, bilingual EN/CN decks, founder vision statements."
      },
      "exampleOutputs": [
        {
          "path": "./example.html",
          "title": "Html Ppt Zhangzara Broadside"
        }
      ]
    },
    "context": {
      "skills": [
        {
          "path": "./SKILL.md"
        }
      ],
      "assets": [
        "./example.html"
      ]
    },
    "pipeline": {
      "stages": [
        {
          "id": "generate",
          "atoms": [
            "file-write",
            "live-artifact"
          ]
        }
      ]
    },
    "capabilities": [
      "prompt:inject",
      "fs:write"
    ]
  }
}
