{
  "$schema": "https://open-design.ai/schemas/plugin.v1.json",
  "specVersion": "1.0.0",
  "name": "example-html-ppt-zhangzara-retro-windows",
  "title": "Html Ppt Zhangzara Retro Windows",
  "version": "0.1.0",
  "description": "Retro Windows — Windows 95 chrome: gray title bars, MS Sans Serif, pixel typography, full nostalgia. Anything that should feel knowingly nostalgic: retro gaming, Y2K-aesthetic brands, creator portfolios with a 90s vibe, tech-history talks, deliberately tongue-in-cheek decks.",
  "license": "MIT",
  "author": {
    "name": "Auto Design",
    "url": "https://github.com/aresbit"
  },
  "homepage": "https://github.com/aresbit/autoagent-design/tree/main/plugins/_official/examples/html-ppt-zhangzara-retro-windows",
  "tags": [
    "example",
    "first-party",
    "deck",
    "marketing",
    "web",
    "retro-windows",
    "zhangzara-retro-windows",
    "nostalgic",
    "retro",
    "winking",
    "retro-gaming-pitch",
    "y2k-brand",
    "html-deck",
    "html-slides",
    "zhangzara"
  ],
  "compat": {
    "agentSkills": [
      {
        "path": "./SKILL.md"
      }
    ]
  },
  "od": {
    "kind": "scenario",
    "taskKind": "new-generation",
    "mode": "deck",
    "scenario": "marketing",
    "surface": "web",
    "preview": {
      "type": "html",
      "entry": "./example.html"
    },
    "useCase": {
      "query": {
        "en": "Retro Windows — Windows 95 chrome: gray title bars, MS Sans Serif, pixel typography, full nostalgia. Anything that should feel knowingly nostalgic: retro gaming, Y2K-aesthetic brands, creator portfolios with a 90s vibe, tech-history talks, deliberately tongue-in-cheek decks.",
        "zh-CN": "使用这个插件完成以下任务：Retro Windows — Windows 95 chrome: gray title bars, MS Sans Serif, pixel typography, full nostalgia. Anything that should feel knowingly nostalgic: retro gaming, Y2K-aesthetic brands, creator portfolios with a 90s vibe, tech-history talks, deliberately tongue-in-cheek decks."
      },
      "exampleOutputs": [
        {
          "path": "./example.html",
          "title": "Html Ppt Zhangzara Retro Windows"
        }
      ]
    },
    "context": {
      "skills": [
        {
          "path": "./SKILL.md"
        }
      ],
      "assets": [
        "./example.html"
      ]
    },
    "pipeline": {
      "stages": [
        {
          "id": "generate",
          "atoms": [
            "file-write",
            "live-artifact"
          ]
        }
      ]
    },
    "capabilities": [
      "prompt:inject",
      "fs:write"
    ]
  }
}
