{
  "$schema": "https://open-design.ai/schemas/plugin.v1.json",
  "specVersion": "1.0.0",
  "name": "example-html-ppt-zhangzara-bold-poster",
  "title": "Html Ppt Zhangzara Bold Poster",
  "version": "0.1.0",
  "description": "Bold Poster — Editorial poster aesthetic with massive Shrikhand display and a single fire-engine red accent. Anything that should land like a magazine cover: brand manifestos, founder vision decks, editorial / cultural pitches, creative reviews.",
  "license": "MIT",
  "author": {
    "name": "Auto Design",
    "url": "https://github.com/aresbit"
  },
  "homepage": "https://github.com/aresbit/autoagent-design/tree/main/plugins/_official/examples/html-ppt-zhangzara-bold-poster",
  "tags": [
    "example",
    "first-party",
    "deck",
    "marketing",
    "web",
    "bold-poster",
    "zhangzara-bold-poster",
    "bold",
    "editorial",
    "dramatic",
    "graphic",
    "brand-manifesto",
    "creative-led-pitch",
    "html-deck",
    "html-slides",
    "zhangzara"
  ],
  "compat": {
    "agentSkills": [
      {
        "path": "./SKILL.md"
      }
    ]
  },
  "od": {
    "kind": "scenario",
    "taskKind": "new-generation",
    "mode": "deck",
    "scenario": "marketing",
    "surface": "web",
    "preview": {
      "type": "html",
      "entry": "./example.html"
    },
    "useCase": {
      "query": {
        "en": "Bold Poster — Editorial poster aesthetic with massive Shrikhand display and a single fire-engine red accent. Anything that should land like a magazine cover: brand manifestos, founder vision decks, editorial / cultural pitches, creative reviews.",
        "zh-CN": "使用这个插件完成以下任务：Bold Poster — Editorial poster aesthetic with massive Shrikhand display and a single fire-engine red accent. Anything that should land like a magazine cover: brand manifestos, founder vision decks, editorial / cultural pitches, creative reviews."
      },
      "exampleOutputs": [
        {
          "path": "./example.html",
          "title": "Html Ppt Zhangzara Bold Poster"
        }
      ]
    },
    "context": {
      "skills": [
        {
          "path": "./SKILL.md"
        }
      ],
      "assets": [
        "./example.html"
      ]
    },
    "pipeline": {
      "stages": [
        {
          "id": "generate",
          "atoms": [
            "file-write",
            "live-artifact"
          ]
        }
      ]
    },
    "capabilities": [
      "prompt:inject",
      "fs:write"
    ]
  }
}
