{
  "$schema": "https://open-design.ai/schemas/plugin.v1.json",
  "specVersion": "1.0.0",
  "name": "example-deck-open-slide-canvas",
  "title": "1920 画布自由 Deck",
  "version": "0.1.0",
  "description": "锁死 1920×1080 画布, React 组件级自由组合, 不绑模板",
  "license": "MIT",
  "author": {
    "name": "Auto Design",
    "url": "https://github.com/aresbit"
  },
  "homepage": "https://github.com/aresbit/autoagent-design/tree/main/plugins/_official/examples/deck-open-slide-canvas",
  "tags": [
    "example",
    "first-party",
    "deck",
    "design",
    "web",
    "canvas",
    "open-slide",
    "freeform",
    "1920",
    "react"
  ],
  "compat": {
    "agentSkills": [
      {
        "path": "./SKILL.md"
      }
    ]
  },
  "od": {
    "kind": "scenario",
    "taskKind": "new-generation",
    "mode": "deck",
    "scenario": "design",
    "surface": "web",
    "featured": 0.17,
    "preview": {
      "type": "html",
      "entry": "./example.html"
    },
    "useCase": {
      "query": "用「1920 画布自由 Deck」模板把我的内容做成一套「锁死 1920×1080 画布, React 组件级自由组合, 不绑模板」。保持模板的视觉签名，使用真实内容和数据，避免 lorem ipsum 和占位图片。",
      "exampleOutputs": [
        {
          "path": "./example.html",
          "title": "1920 画布自由 Deck"
        }
      ]
    },
    "context": {
      "skills": [
        {
          "path": "./SKILL.md"
        }
      ],
      "assets": [
        "./example.html"
      ]
    },
    "pipeline": {
      "stages": [
        {
          "id": "generate",
          "atoms": [
            "file-write",
            "live-artifact"
          ]
        }
      ]
    },
    "capabilities": [
      "prompt:inject",
      "fs:write"
    ]
  }
}
