{
  "$schema": "https://open-design.ai/schemas/plugin.v1.json",
  "specVersion": "1.0.0",
  "name": "image-template-illustration-crayon-kid-drawing-rework",
  "title": "Illustration - Crayon Kid-Drawing Rework",
  "version": "0.1.0",
  "description": "A style-transfer prompt that reworks any reference image (product shot, screenshot, portrait, UI mockup) into a hand-drawn crayon illustration that feels like it was made by a 10-year-old. Replaces the original palette with bright playful crayon colors on clean white paper, and sprinkles childlike whimsy — castles, candy, stars, clouds, rainbows — to amplify the innocent storybook vibe. Works as an image-to-image edit in GPT-image-2 (requires uploading a reference image alongside the prompt); well-suited to website screenshots, brand key art, product photos, and portraits.",
  "license": "Apache-2.0",
  "author": {
    "name": "open-design contributors",
    "url": "https://github.com/aresbit/autoagent-design"
  },
  "homepage": "https://github.com/aresbit/autoagent-design",
  "tags": [
    "image-template",
    "first-party",
    "image",
    "illustration",
    "crayon",
    "childlike",
    "style-transfer",
    "hand-drawn",
    "image-to-image",
    "rework",
    "transform"
  ],
  "od": {
    "kind": "scenario",
    "taskKind": "new-generation",
    "mode": "image",
    "scenario": "image",
    "surface": "image",
    "preview": {
      "type": "image",
      "poster": "https://raw.githubusercontent.com/aresbit/autoagent-design/main/assets/prompt-templates/image/illustration-crayon-kid-drawing-rework.jpg"
    },
    "useCase": {
      "query": {
        "en": "Rework the given image into a crayon-style illustration, transforming the entire scene into something that feels hand-drawn by a 10-year-old. Preserve the general layout and spatial relationships of the original image — transform the style first, embellish second, so small UI elements, faces, and logos stay where they are. Keep the forms simple and slightly imperfect, like a child's drawing — wobbly outlines, uneven strokes, visible waxy crayon texture, soft smudges where colors overlap.\n\nAvoid using the original color palette — replace it with bright, playful crayon colors (sunshine yellow, candy pink, sky blue, mint green, lavender, tangerine, grass green) on a clean white paper background with subtle paper grain. Aim for a soft, cute, and innocent aesthetic.\n\nIncorporate fun, childlike details such as fairy-tale castles or towers in the corners, lollipops and candy, big shiny five-point stars, fluffy rounded clouds, a rainbow arc, a cheerful smiling sun, tiny hearts and sparkles scattered across the page to amplify the playful vibe. Keep the main subject of the reference image clearly recognizable — redraw it in crayon rather than replacing it — and render any visible text as wobbly kid handwriting that stays legible.\n\nThe final result should feel charming, colorful, and full of childlike imagination — like a kid pulled out a fresh crayon box and happily redrew the reference on a sheet of white paper.\n\nNegative prompt: no photo-realistic rendering, no sharp vector lines, no 3D shading, no airbrush gradients, no dark or muddy palette, no adult fine-art technique, no watermark, no frame border, no garbled text.",
        "zh-CN": "使用这个插件完成以下任务：Rework the given image into a crayon-style illustration, transforming the entire scene into something that feels hand-drawn by a 10-year-old. Preserve the general layout and spatial relationships of the original image — transform the style first, embellish second, so small UI elements, faces, and logos stay where they are. Keep the forms simple and slightly imperfect, like a child's drawing — wobbly outlines, uneven strokes, visible waxy crayon texture, soft smudges where colors overlap.\n\nAvoid using the original color palette — replace it with bright, playful crayon colors (sunshine yellow, candy pink, sky blue, mint green, lavender, tangerine, grass green) on a clean white paper background with subtle paper grain. Aim for a soft, cute, and innocent aesthetic.\n\nIncorporate fun, childlike details such as fairy-tale castles or towers in the corners, lollipops and candy, big shiny five-point stars, fluffy rounded clouds, a rainbow arc, a cheerful smiling sun, tiny hearts and sparkles scattered across the page to amplify the playful vibe. Keep the main subject of the reference image clearly recognizable — redraw it in crayon rather than replacing it — and render any visible text as wobbly kid handwriting that stays legible.\n\nThe final result should feel charming, colorful, and full of childlike imagination — like a kid pulled out a fresh crayon box and happily redrew the reference on a sheet of white paper.\n\nNegative prompt: no photo-realistic rendering, no sharp vector lines, no 3D shading, no airbrush gradients, no dark or muddy palette, no adult fine-art technique, no watermark, no frame border, no garbled text."
      }
    },
    "inputs": [
      {
        "name": "model",
        "label": "Model",
        "type": "select",
        "options": [
          "gpt-image-2"
        ],
        "default": "gpt-image-2"
      },
      {
        "name": "aspect",
        "label": "Aspect ratio",
        "type": "select",
        "options": [
          "1:1",
          "16:9",
          "9:16",
          "4:5",
          "3:2"
        ],
        "default": "4:3"
      }
    ],
    "context": {
      "assets": [
        "./template.json"
      ]
    },
    "pipeline": {
      "stages": [
        {
          "id": "generate",
          "atoms": [
            "image-generate"
          ]
        }
      ]
    },
    "capabilities": [
      "prompt:inject",
      "media:image-generate"
    ]
  }
}
