{
  "$schema": "https://open-design.ai/schemas/plugin.v1.json",
  "specVersion": "1.0.0",
  "name": "example-html-ppt-zhangzara-blue-professional",
  "title": "Html Ppt Zhangzara Blue Professional",
  "version": "0.1.0",
  "description": "Blue Professional — Cream paper background with electric cobalt blue accents; clean modern professional. Anything that should feel modern-considered and lightly authoritative: B2B SaaS pitches, consulting deliverables, advisory updates, investor reports.",
  "license": "MIT",
  "author": {
    "name": "Auto Design",
    "url": "https://github.com/aresbit"
  },
  "homepage": "https://github.com/aresbit/autoagent-design/tree/main/plugins/_official/examples/html-ppt-zhangzara-blue-professional",
  "tags": [
    "example",
    "first-party",
    "deck",
    "marketing",
    "web",
    "blue-professional",
    "zhangzara-blue-professional",
    "professional",
    "modern",
    "clean",
    "considered",
    "b2b-saas-pitch",
    "consulting-deliverable",
    "html-deck",
    "html-slides",
    "zhangzara"
  ],
  "compat": {
    "agentSkills": [
      {
        "path": "./SKILL.md"
      }
    ]
  },
  "od": {
    "kind": "scenario",
    "taskKind": "new-generation",
    "mode": "deck",
    "scenario": "marketing",
    "surface": "web",
    "preview": {
      "type": "html",
      "entry": "./example.html"
    },
    "useCase": {
      "query": {
        "en": "Blue Professional — Cream paper background with electric cobalt blue accents; clean modern professional. Anything that should feel modern-considered and lightly authoritative: B2B SaaS pitches, consulting deliverables, advisory updates, investor reports.",
        "zh-CN": "使用这个插件完成以下任务：Blue Professional — Cream paper background with electric cobalt blue accents; clean modern professional. Anything that should feel modern-considered and lightly authoritative: B2B SaaS pitches, consulting deliverables, advisory updates, investor reports."
      },
      "exampleOutputs": [
        {
          "path": "./example.html",
          "title": "Html Ppt Zhangzara Blue Professional"
        }
      ]
    },
    "context": {
      "skills": [
        {
          "path": "./SKILL.md"
        }
      ],
      "assets": [
        "./example.html"
      ]
    },
    "pipeline": {
      "stages": [
        {
          "id": "generate",
          "atoms": [
            "file-write",
            "live-artifact"
          ]
        }
      ]
    },
    "capabilities": [
      "prompt:inject",
      "fs:write"
    ]
  }
}
