{
  "$schema": "https://open-design.ai/schemas/plugin.v1.json",
  "specVersion": "1.0.0",
  "name": "example-pptx-html-fidelity-audit",
  "title": "Pptx Html Fidelity Audit",
  "version": "0.1.0",
  "description": "Audit a python-pptx export against its source HTML deck, identify layout/content drift (footer overflow, cropped content, missing italic/em, lost styling, off-rhythm spacing), and re-export with strict footer-rail + cursor-flow layout discipline. Use this skill whenever the user has a .pptx that was generated from an HTML slide deck and asks to compare/audit/verify/fix the export — including phrases like \"compare ppt with html\", \"fidelity audit\", \"fix the pptx\", \"ppt is cut off\", \"footer overlap\", \"italic missing in pptx\", \"re-export the deck\", \"pptx-html-fidelity-audit\", or any case where a python-pptx → HTML round-trip needs verification or repair. Also trigger when the user shows you a deck.html and a deck.pptx side by side and is debugging visual differences.",
  "license": "MIT",
  "author": {
    "name": "Auto Design",
    "url": "https://github.com/aresbit"
  },
  "homepage": "https://github.com/aresbit/autoagent-design/tree/main/plugins/_official/examples/pptx-html-fidelity-audit",
  "tags": [
    "example",
    "first-party",
    "utility",
    "engineering",
    "web",
    "pptx-fidelity",
    "pptx-audit",
    "ppt",
    "untitled",
    "footer-overlap",
    "verify-pptx",
    "html-to-pptx"
  ],
  "compat": {
    "agentSkills": [
      {
        "path": "./SKILL.md"
      }
    ]
  },
  "od": {
    "kind": "scenario",
    "taskKind": "new-generation",
    "mode": "utility",
    "scenario": "engineering",
    "surface": "web",
    "preview": {
      "type": "html",
      "entry": "./example.html"
    },
    "useCase": {
      "query": {
        "en": "Audit a python-pptx export against its source HTML deck, identify layout/content drift (footer overflow, cropped content, missing italic/em, lost styling, off-rhythm spacing), and re-export with strict footer-rail + cursor-flow layout discipline. Use this skill whenever the user has a .pptx that was generated from an H",
        "zh-CN": "使用这个插件完成以下任务：Audit a python-pptx export against its source HTML deck, identify layout/content drift (footer overflow, cropped content, missing italic/em, lost styling, off-rhythm spacing), and re-export with strict footer-rail + cursor-flow layout discipline. Use this skill whenever the user has a .pptx that was generated from an H"
      }
    },
    "context": {
      "skills": [
        {
          "path": "./SKILL.md"
        }
      ],
      "designSystem": {
        "primary": true
      },
      "assets": [
        "./references/audit-table-template.md",
        "./references/font-discipline.md",
        "./references/layout-discipline.md"
      ]
    },
    "pipeline": {
      "stages": [
        {
          "id": "generate",
          "atoms": [
            "file-write",
            "live-artifact"
          ]
        }
      ]
    },
    "capabilities": [
      "prompt:inject",
      "fs:write"
    ]
  }
}
